Tool Name,Category,API Available (Y/N),Authentication Type,Free Credits / Tokens,Credits / Tokens Used,Rate Limit,Companies Processed,Coverage (%),Success Rate (%),Error Rate (%),Average Latency,Gated Fields,Free Tier Limitation,Paid Plan Cost,Paid Tier Benefits,Ease of Integration,API Documentation Quality,Evidence Link,Overall API Score,Status,Remarks,Data Completeness (%),Records Retrieved,Estimated Cost per 100 Companies,Raw Export Saved (Y/N)
Exa Search API,News / Key Announcements,Y,x-api-key header,Account-specific free credits,1 search request; 1 search request; 1 search request; 1 search request; 1 search request; 1 search request; 1 search request; 1 search request; 1 search request; 1 search request,Provider/account specific,10,100.00,100.00,0.00,0.00 ms,None identified in parsed output,Account-specific free credits,Vendor/account specific,Higher volume and contents extraction,Good - standard REST/JSON or RSS,Good - endpoint documented,https://exa.ai/docs/reference/search,5.00/5,Success,Search endpoint returned company announcement/news URLs.,100.00,100,About 100 search requests for 100 companies at one query per company; exact cost is plan specific.,Y
Tavily Search API,News / Key Announcements,Y,Bearer API key,Free/dev credits,1 search request; 1 search request; 1 search request; 1 search request; 1 search request; 1 search request; 1 search request; 1 search request; 1 search request; 1 search request,Provider/account specific,10,100.00,100.00,0.00,0.00 ms,None identified in parsed output,Free/dev credits,Vendor/account specific,Advanced search/extract,Good - standard REST/JSON or RSS,Good - endpoint documented,https://docs.tavily.com/documentation/api-reference/endpoint/search,5.00/5,Success,Search endpoint run with topic=news.,100.00,100,About 100 search requests for 100 companies at one query per company; exact cost is plan specific.,Y
Google News RSS,News / Key Announcements,Y,None,No API key,0 (RSS); 0 (RSS); 0 (RSS); 0 (RSS); 0 (RSS); 0 (RSS); 0 (RSS); 0 (RSS); 0 (RSS); 0 (RSS),Google RSS behavior is unofficial,10,100.00,100.00,0.00,0.00 ms,"Event type (funding, expansion, launch, leadership, M&A)",No API key,Vendor/account specific,Paid alternatives provide SLA and cleaner source metadata,Good - standard REST/JSON or RSS,RSS endpoint; limited official API documentation,https://news.google.com/rss/search,4.91/5,Success,No API key required; RSS parsed into normalized events.,94.00,100,0 API cost; reliability/SLA not guaranteed.,Y
NewsAPI Everything API,News / Key Announcements,Y,apiKey query parameter,Developer plan limitations,1 request; 1 request; 1 request; 1 request; 1 request; 1 request; 1 request; 1 request; 1 request; 1 request,Plan-specific,10,100.00,100.00,0.00,0.00 ms,"Event type (funding, expansion, launch, leadership, M&A)",Developer plan limitations,Vendor/account specific,Broader history and higher quota,Good - standard REST/JSON or RSS,Good - endpoint documented,https://newsapi.org/docs/endpoints/everything,4.94/5,Success,Everything endpoint queried for company events.,96.00,84,About 100 search requests for 100 companies at one query per company; exact cost is plan specific.,Y
PredictLeads News/Events API,News / Key Announcements,N,API key,Invalid/missing key,0; 0; 0; 0; 0; 0; 0; 0; 0; 0,Plan-specific,10,0.00,0.00,100.00,0.00 ms,None identified in parsed output,Invalid/missing key,Vendor/account specific,Structured company event endpoints,Not assessed,Good - endpoint documented,https://docs.predictleads.com/,1.00/5,Not executed - invalid/missing API key,No valid key available; not executed.,0.00,0,Not assessed.,Y
GDELT,News / Key Announcements,Not used,None,No API key required,0; 0; 0; 0; 0; 0; 0; 0; 0; 0,Public endpoint limits,10,0.00,0.00,100.00,0.00 ms,None identified in parsed output,No API key required,Vendor/account specific,Can add global event search later,Not assessed,Good - endpoint documented,https://www.gdeltproject.org/,1.00/5,Not executed - out of scoped live run,Not used because scope says no API and enough providers are available.,0.00,0,Not assessed.,Y
