Tool Name,Category,API Available (Y/N),Authentication Type,Free Credits / Tokens,Credits / Tokens Used,Rate Limit,Companies Processed,Coverage (%),Success Rate (%),Error Rate (%),Average Latency,Gated Fields,Free Tier Limitation,Paid Plan Cost,Paid Tier Benefits,Ease of Integration,API Documentation Quality,Evidence Link,Overall API Score,Status,Remarks,Data Completeness (%),Records Retrieved,Estimated Cost per 100 Companies,Raw Export Saved (Y/N)
PredictLeads Job Openings API,Jobs / Hiring,Y,API key query/header,Free 100 requests/month,0; 0; 0; 0; 0; 0; 0; 0; 0; 0,100 requests per month free tier,10,0.00,0.00,100.00,0.00 ms,None identified in parsed output,Free 100 requests/month,Vendor/account specific,Vendor paid dataset/API access,Blocked by access/credential,Good - endpoint documented,https://docs.predictleads.com/,1.00/5,Not executed - invalid API key,Invalid credential in inventory; no valid live test completed.,0.00,0,100 free requests/month if valid; paid plan required beyond free tier.,Y
TheirStack Job Search API,Jobs / Hiring,Y,Bearer API key,200 credits/month; job search costs 1 credit per returned job,0 (reuse-raw); 0 (reuse-raw); 0 (reuse-raw); 0 (reuse-raw); 0 (reuse-raw); 0 (reuse-raw); 0 (reuse-raw); 0 (reuse-raw); 0 (reuse-raw); 0 (reuse-raw),Vendor/account rate limits in response headers,10,100.00,100.00,0.00,0.00 ms,None identified in parsed output,200 credits/month; job search costs 1 credit per returned job,Vendor/account specific,Higher volume job search and filters,Good - standard REST/JSON,Good - endpoint documented,https://theirstack.com/en/docs/api-reference/jobs/search_jobs_v1,5.00/5,Success,Job endpoint docs are clear; use company_domain_or and include_total_results.,100.00,100,About returned-job credits only; this run capped samples to control spend.,Y
Coresignal Multi-source Company Jobs Signals,Jobs / Hiring,Y,API key header,Trial Search/Collect credits,0 (reuse raw); 0 (reuse raw); 0 (reuse raw); 0 (reuse raw); 0 (reuse raw); 0 (reuse raw); 0 (reuse raw); 0 (reuse raw); 0 (reuse raw); 0 (reuse raw),18 req/sec documented across CoreSignal enrichment endpoints; Jobs API docs list search/collect endpoints,10,100.00,100.00,0.00,0.00 ms,Active job count (total); Job locations; Posting first-seen date; Roles by function (eng/design/IT/sales/ops); Source URL,Trial Search/Collect credits,Vendor/account specific,Multi-source Jobs Search/Collect endpoints and bulk delivery,Good - standard REST/JSON,Good - endpoint documented,https://docs.coresignal.com/jobs-api/multi-source-jobs-api,4.31/5,Success,Reused saved company enrichment raw exports; dedicated Jobs API available for future deeper collection.,54.28,3887,Reuse from company enrichment is 0 additional calls; dedicated Jobs API pricing depends on Search/Collect credits.,Y
Apollo Organization Job Postings API,Jobs / Hiring,Y,Bearer or X-Api-Key,Existing paid plan; credits are plan dependent,0 (reuse-raw); 0 (reuse-raw); 0 (reuse-raw); 0 (reuse-raw); 0 (reuse-raw); 0 (reuse-raw); 0 (reuse-raw); 0 (reuse-raw); 0 (reuse-raw); 0 (reuse-raw),Apollo rate limits are account/plan dependent,10,100.00,100.00,0.00,0.00 ms,None identified in parsed output,Existing paid plan; credits are plan dependent,Vendor/account specific,Plan-dependent job postings access and rate limits,Good - standard REST/JSON,Good - endpoint documented,https://docs.apollo.io/reference/organization-jobs-postings,5.00/5,Success,Requires Apollo organization_id from company enrichment.,100.00,234,About 100 Apollo job-postings calls for 100 companies; exact credit cost is plan specific.,Y
LinkUp / Aura,Jobs / Hiring,Sample on request,Demo/sample request,Sample on request,0; 0; 0; 0; 0; 0; 0; 0; 0; 0,Vendor specific,10,0.00,0.00,100.00,0.00 ms,None identified in parsed output,Sample on request,Vendor/account specific,Enterprise access to job postings feeds,Blocked by access/credential,Not assessed - sample/demo required,https://www.linkup.com/developers/; https://www.aura.com/,1.00/5,Not executed - sample/demo on request,Not executed because access is sample/demo on request.,0.00,0,Sample/demo required.,Y
